"Status","Name","Duration in ms","Description"
"passed","TC_6_Listing_Data.listingCamerasData","7078","This test is make a success data listing with the category of cameras"
"passed","TC_1_2_Register.signUp","10901","This test is make a success register with valid values, and with Your Account Has Been Created! - message"
"passed","TC_13_Logout.logout","31185","This test is logout the user after login"
"passed","TC_3_4_Login.loginFailed","8612","This test is make an unsuccess login with user, and with  Warning: No match for E-Mail Address and/or Password. - message"
"passed","TC_5_Privacy_Policy.signUpWithPpCheck","11213","This test is make a success register with valid values, and with open the privacy policy"
"passed","TC_3_4_Login.login","8738","This test is make a success login with a valid user"
"passed","TC_1_2_Register.signUpFailed","10886","This test is make an unsuccess register, with Warning: E-Mail Address is already registered! - message"
"passed","TC_7_Pagination.listingCamerasData","8561","This test is paging between the desktops targets"
"passed","TC_8_Input_Of_New_Data.listingCamerasData","11052","This test is sending a complaint to the support"
